{"analysisKind":"dead-antecedent","analysisModelProfile":"quire.analysis-model/v1","assertions":[{"clause":"agent-ix/analysis-test:REQ-v2-identity@1:C-v2-identity","clauseDigest":"6600108711d0447dc7f4b463a62bf17701df006119940114d413207c582e8283","name":"a_p6167656e742d69782f616e616c797369732d74657374_r5245512d76322d6964656e74697479_v1_c432d76322d6964656e74697479_dcc9269cd1e2f431ecf686e3341234714d69199cc72f01368fa062e10c608570b","polarity":"positive","role":"antecedent","source":{"document":"analysis-test","end":{"byte":12,"column":13,"line":1},"revision":1,"start":{"byte":11,"column":12,"line":1}}}],"bindingSetDigest":"daa158def1bead2dfb56775f000e5f8e169a736dcea35e47f5a3afa10a5ef765","contractIrRevision":"bb5d30cbb1519b7ac286250114c96ba967661cba","differential":{"agreedStatus":"satisfied","disposition":"agreement"},"encodingProfile":"quire.smtlib2/v1","engines":[{"argv":["-in","-smt2"],"cleanupMs":0,"configurationDigest":"11d1358e1dac464eca26616194c41dde7f21cfff1e6034869f77761e366111df","configuredExecutable":"/fixture/solver/z3","diagnostic":null,"elapsedMs":10,"engine":"z3","expectedExecutableSha256":"7fb9cef71cdceab7d33e637f1806f0fa3804b62a41ae586100e99f73e955d0df","expectedVersion":"fake-analysis-solver 1.0","explanation":"not-applicable","identity":{"bytes":157,"path":"/fixture/solver/z3","sha256":"7fb9cef71cdceab7d33e637f1806f0fa3804b62a41ae586100e99f73e955d0df","version":"fake-analysis-solver 1.0"},"limits":{"cleanupTimeMs":1000,"executableBytes":536870912,"gracefulCleanupMs":100,"modelBytes":8388608,"monitorIntervalMs":5,"pathBytes":4096,"stderrBytes":1048576,"stdinBytes":16777216,"stdoutBytes":16777216,"versionBytes":65536,"wallTimeMs":5000},"modelHex":"","modelSha256":"e3b0c44298fc1c149afbf4c8996fb92427ae41e4649b934ca495991b7852b855","outcome":"unsat","processExit":{"code":0,"signal":null},"profile":"quire.solver-process/v1","queryDigest":"ba4f967d679a5275be1d2325ae2cc3cf955c4020c6bf0a514e7a810ebde17691","status":"satisfied","stderrHex":"","stderrSha256":"e3b0c44298fc1c149afbf4c8996fb92427ae41e4649b934ca495991b7852b855","stdoutHex":"756e7361740a","stdoutSha256":"5c17dfcc2a8f1f30d9e96df6a9825a5030ade046d560332c19de74d93d591a18"},{"argv":["--lang=smt2","--no-incremental"],"cleanupMs":0,"configurationDigest":"c2e1459b2c407dab250dff1a665aaa8b9e7b22c3055db6d777f27c85f0ad9292","configuredExecutable":"/fixture/solver/cvc5","diagnostic":null,"elapsedMs":10,"engine":"cvc5","expectedExecutableSha256":"7fb9cef71cdceab7d33e637f1806f0fa3804b62a41ae586100e99f73e955d0df","expectedVersion":"fake-analysis-solver 1.0","explanation":"not-applicable","identity":{"bytes":157,"path":"/fixture/solver/cvc5","sha256":"7fb9cef71cdceab7d33e637f1806f0fa3804b62a41ae586100e99f73e955d0df","version":"fake-analysis-solver 1.0"},"limits":{"cleanupTimeMs":1000,"executableBytes":536870912,"gracefulCleanupMs":100,"modelBytes":8388608,"monitorIntervalMs":5,"pathBytes":4096,"stderrBytes":1048576,"stdinBytes":16777216,"stdoutBytes":16777216,"versionBytes":65536,"wallTimeMs":5000},"modelHex":"","modelSha256":"e3b0c44298fc1c149afbf4c8996fb92427ae41e4649b934ca495991b7852b855","outcome":"unsat","processExit":{"code":0,"signal":null},"profile":"quire.solver-process/v1","queryDigest":"ba4f967d679a5275be1d2325ae2cc3cf955c4020c6bf0a514e7a810ebde17691","status":"satisfied","stderrHex":"","stderrSha256":"e3b0c44298fc1c149afbf4c8996fb92427ae41e4649b934ca495991b7852b855","stdoutHex":"756e7361740a","stdoutSha256":"5c17dfcc2a8f1f30d9e96df6a9825a5030ade046d560332c19de74d93d591a18"}],"logic":"QF_UF","pgm01Envelope":{"dependency":"agent-ix/quire-contract-ir#20","status":"unavailable"},"producer":{"name":"quire-analyze","version":"0.1.0"},"queryDigest":"ba4f967d679a5275be1d2325ae2cc3cf955c4020c6bf0a514e7a810ebde17691","queryHex":"287365742d696e666f203a736d742d6c69622d76657273696f6e20322e36290a287365742d696e666f203a736f75726365207c71756972652e736d746c6962322f76317c290a287365742d6f7074696f6e203a70726f647563652d6d6f64656c732074727565290a287365742d6c6f6769632051465f5546290a286173736572742028212066616c7365203a6e616d656420615f7036313637363536653734326436393738326636313665363136633739373336393733326437343635373337345f723532343535313264373633323264363936343635366537343639373437395f76315f6334333264373633323264363936343635366537343639373437395f646363393236396364316532663433316563663638366533333431323334373134643639313939636337326630313336386661303632653130633630383537306229290a28636865636b2d736174290a286765742d6d6f64656c290a","querySha256":"3caf64923628afe8b64bbc35fb6b3cf6a2339e135da5521c5f48ea2a44745260","reportDigest":"2b4390f98a67d1dd4d987ac3bdb28ca451b23179412918c9683e1f41a9817e1e","requestDigest":"cd7f65b97e396738e35f952daab0bdc1e1aedf0bfa2e856cff636d43493dede5","schema":"quire.differential-report/v1"}